{
  "projectId": "project_b1f1b796-a3d0-4a3d-9f3c-13e3649e286a",
  "status": "PASS",
  "artifacts": {
    "referenceStyleDna": "C:\\Users\\urmylucky\\Documents\\ChatGPT\\PPT\\.worktrees\\visual-quality-gate\\generated\\projects\\project_b1f1b796-a3d0-4a3d-9f3c-13e3649e286a\\style\\style-dna.json",
    "contentAnalysis": "C:\\Users\\urmylucky\\Documents\\ChatGPT\\PPT\\.worktrees\\visual-quality-gate\\generated\\projects\\project_b1f1b796-a3d0-4a3d-9f3c-13e3649e286a\\analysis\\content-analysis.json",
    "storyline": "C:\\Users\\urmylucky\\Documents\\ChatGPT\\PPT\\.worktrees\\visual-quality-gate\\generated\\projects\\project_b1f1b796-a3d0-4a3d-9f3c-13e3649e286a\\storyline\\storyline.json",
    "slidePlan": "C:\\Users\\urmylucky\\Documents\\ChatGPT\\PPT\\.worktrees\\visual-quality-gate\\generated\\projects\\project_b1f1b796-a3d0-4a3d-9f3c-13e3649e286a\\slide-plans\\slide-plans.json",
    "styleMix": "C:\\Users\\urmylucky\\Documents\\ChatGPT\\PPT\\.worktrees\\visual-quality-gate\\generated\\projects\\project_b1f1b796-a3d0-4a3d-9f3c-13e3649e286a\\style\\style-mix.json",
    "qaReport": "C:\\Users\\urmylucky\\Documents\\ChatGPT\\PPT\\.worktrees\\visual-quality-gate\\generated\\projects\\project_b1f1b796-a3d0-4a3d-9f3c-13e3649e286a\\qa\\qa-report.json",
    "repairPlan": null,
    "finalPptx": "C:\\Users\\urmylucky\\Documents\\ChatGPT\\PPT\\.worktrees\\visual-quality-gate\\generated\\projects\\project_b1f1b796-a3d0-4a3d-9f3c-13e3649e286a\\output\\final.pptx",
    "contactSheet": "C:\\Users\\urmylucky\\Documents\\ChatGPT\\PPT\\.worktrees\\visual-quality-gate\\generated\\projects\\project_b1f1b796-a3d0-4a3d-9f3c-13e3649e286a\\render\\final\\contact-sheet.webp",
    "reopenedContactSheet": "C:\\Users\\urmylucky\\Documents\\ChatGPT\\PPT\\.worktrees\\visual-quality-gate\\generated\\projects\\project_b1f1b796-a3d0-4a3d-9f3c-13e3649e286a\\render\\reopened-final\\contact-sheet.webp",
    "strength90": "/api/files?projectId=project_b1f1b796-a3d0-4a3d-9f3c-13e3649e286a&stage=render&name=previews/strength-90/A/contact-sheet.webp",
    "strength50": "/api/files?projectId=project_b1f1b796-a3d0-4a3d-9f3c-13e3649e286a&stage=render&name=previews/strength-50/A/contact-sheet.webp"
  },
  "checks": {
    "referenceSlidesRendered": true,
    "strengthDifference": 0.0103,
    "strengthDifferenceVisible": true,
    "distinctDirections": true,
    "selectedDirection": "B",
    "finalPptxOpenable": true,
    "reopenedSlides": 8,
    "typeCounts": {
      "text": 72,
      "shape": 35,
      "chart": 1,
      "table": 0,
      "image": 0
    },
    "nativeObjects": 108,
    "imageObjects": 0,
    "editableRatio": 1,
    "cjkPresent": true,
    "cjkCorruptionAbsent": true,
    "qaStatus": "PASS",
    "qaOverall": 91,
    "qaReadability": 96,
    "qaAiLookScore": 4,
    "repairTriggered": false
  },
  "generatedAt": "2026-08-22T11:33:56.901Z"
}