{
  "projectId": "project_1c9074d9-259e-422d-b203-0c404bf87989",
  "status": "PASS",
  "artifacts": {
    "referenceStyleDna": "C:\\Users\\urmylucky\\Documents\\ChatGPT\\PPT\\.worktrees\\contrast-local-autofix\\generated\\projects\\project_1c9074d9-259e-422d-b203-0c404bf87989\\style\\style-dna.json",
    "contentAnalysis": "C:\\Users\\urmylucky\\Documents\\ChatGPT\\PPT\\.worktrees\\contrast-local-autofix\\generated\\projects\\project_1c9074d9-259e-422d-b203-0c404bf87989\\analysis\\content-analysis.json",
    "storyline": "C:\\Users\\urmylucky\\Documents\\ChatGPT\\PPT\\.worktrees\\contrast-local-autofix\\generated\\projects\\project_1c9074d9-259e-422d-b203-0c404bf87989\\storyline\\storyline.json",
    "slidePlan": "C:\\Users\\urmylucky\\Documents\\ChatGPT\\PPT\\.worktrees\\contrast-local-autofix\\generated\\projects\\project_1c9074d9-259e-422d-b203-0c404bf87989\\slide-plans\\slide-plans.json",
    "styleMix": "C:\\Users\\urmylucky\\Documents\\ChatGPT\\PPT\\.worktrees\\contrast-local-autofix\\generated\\projects\\project_1c9074d9-259e-422d-b203-0c404bf87989\\style\\style-mix.json",
    "qaReport": "C:\\Users\\urmylucky\\Documents\\ChatGPT\\PPT\\.worktrees\\contrast-local-autofix\\generated\\projects\\project_1c9074d9-259e-422d-b203-0c404bf87989\\qa\\qa-report.json",
    "repairPlan": "C:\\Users\\urmylucky\\Documents\\ChatGPT\\PPT\\.worktrees\\contrast-local-autofix\\generated\\projects\\project_1c9074d9-259e-422d-b203-0c404bf87989\\qa\\repair-plan.json",
    "finalPptx": "C:\\Users\\urmylucky\\Documents\\ChatGPT\\PPT\\.worktrees\\contrast-local-autofix\\generated\\projects\\project_1c9074d9-259e-422d-b203-0c404bf87989\\output\\final.pptx",
    "contactSheet": "C:\\Users\\urmylucky\\Documents\\ChatGPT\\PPT\\.worktrees\\contrast-local-autofix\\generated\\projects\\project_1c9074d9-259e-422d-b203-0c404bf87989\\render\\final\\contact-sheet.webp",
    "reopenedContactSheet": "C:\\Users\\urmylucky\\Documents\\ChatGPT\\PPT\\.worktrees\\contrast-local-autofix\\generated\\projects\\project_1c9074d9-259e-422d-b203-0c404bf87989\\render\\reopened-final\\contact-sheet.webp",
    "strength90": "/api/files?projectId=project_1c9074d9-259e-422d-b203-0c404bf87989&stage=render&name=previews/strength-90/A/contact-sheet.webp",
    "strength50": "/api/files?projectId=project_1c9074d9-259e-422d-b203-0c404bf87989&stage=render&name=previews/strength-50/A/contact-sheet.webp"
  },
  "checks": {
    "referenceSlidesRendered": true,
    "strengthDifference": 0.0103,
    "strengthDifferenceVisible": true,
    "distinctDirections": true,
    "selectedDirection": "B",
    "finalPptxOpenable": true,
    "reopenedSlides": 8,
    "typeCounts": {
      "text": 72,
      "shape": 35,
      "chart": 1,
      "table": 0,
      "image": 0
    },
    "nativeObjects": 108,
    "imageObjects": 0,
    "editableRatio": 1,
    "cjkPresent": true,
    "cjkCorruptionAbsent": true,
    "qaStatus": "PASS",
    "qaOverall": 93,
    "qaReadability": 96,
    "qaFidelityMode": "measured",
    "qaReferenceFidelity": 96,
    "typographyBefore": 96.1,
    "typographyAfter": 96.1,
    "repairRolledBack": false,
    "qaAiLookScore": 4,
    "repairTriggered": true
  },
  "generatedAt": "2026-08-22T13:10:35.733Z"
}