{
  "projectId": "project_1c2ae0b5-f586-4dd1-9b3b-62fb525e1c48",
  "status": "PASS",
  "artifacts": {
    "referenceStyleDna": "C:\\Users\\urmylucky\\Documents\\ChatGPT\\PPT\\.worktrees\\rendered-fidelity-score\\generated\\projects\\project_1c2ae0b5-f586-4dd1-9b3b-62fb525e1c48\\style\\style-dna.json",
    "contentAnalysis": "C:\\Users\\urmylucky\\Documents\\ChatGPT\\PPT\\.worktrees\\rendered-fidelity-score\\generated\\projects\\project_1c2ae0b5-f586-4dd1-9b3b-62fb525e1c48\\analysis\\content-analysis.json",
    "storyline": "C:\\Users\\urmylucky\\Documents\\ChatGPT\\PPT\\.worktrees\\rendered-fidelity-score\\generated\\projects\\project_1c2ae0b5-f586-4dd1-9b3b-62fb525e1c48\\storyline\\storyline.json",
    "slidePlan": "C:\\Users\\urmylucky\\Documents\\ChatGPT\\PPT\\.worktrees\\rendered-fidelity-score\\generated\\projects\\project_1c2ae0b5-f586-4dd1-9b3b-62fb525e1c48\\slide-plans\\slide-plans.json",
    "styleMix": "C:\\Users\\urmylucky\\Documents\\ChatGPT\\PPT\\.worktrees\\rendered-fidelity-score\\generated\\projects\\project_1c2ae0b5-f586-4dd1-9b3b-62fb525e1c48\\style\\style-mix.json",
    "qaReport": "C:\\Users\\urmylucky\\Documents\\ChatGPT\\PPT\\.worktrees\\rendered-fidelity-score\\generated\\projects\\project_1c2ae0b5-f586-4dd1-9b3b-62fb525e1c48\\qa\\qa-report.json",
    "repairPlan": null,
    "finalPptx": "C:\\Users\\urmylucky\\Documents\\ChatGPT\\PPT\\.worktrees\\rendered-fidelity-score\\generated\\projects\\project_1c2ae0b5-f586-4dd1-9b3b-62fb525e1c48\\output\\final.pptx",
    "contactSheet": "C:\\Users\\urmylucky\\Documents\\ChatGPT\\PPT\\.worktrees\\rendered-fidelity-score\\generated\\projects\\project_1c2ae0b5-f586-4dd1-9b3b-62fb525e1c48\\render\\final\\contact-sheet.webp",
    "reopenedContactSheet": "C:\\Users\\urmylucky\\Documents\\ChatGPT\\PPT\\.worktrees\\rendered-fidelity-score\\generated\\projects\\project_1c2ae0b5-f586-4dd1-9b3b-62fb525e1c48\\render\\reopened-final\\contact-sheet.webp",
    "strength90": "/api/files?projectId=project_1c2ae0b5-f586-4dd1-9b3b-62fb525e1c48&stage=render&name=previews/strength-90/A/contact-sheet.webp",
    "strength50": "/api/files?projectId=project_1c2ae0b5-f586-4dd1-9b3b-62fb525e1c48&stage=render&name=previews/strength-50/A/contact-sheet.webp"
  },
  "checks": {
    "referenceSlidesRendered": true,
    "strengthDifference": 0.0103,
    "strengthDifferenceVisible": true,
    "distinctDirections": true,
    "selectedDirection": "B",
    "finalPptxOpenable": true,
    "reopenedSlides": 8,
    "typeCounts": {
      "text": 72,
      "shape": 35,
      "chart": 1,
      "table": 0,
      "image": 0
    },
    "nativeObjects": 108,
    "imageObjects": 0,
    "editableRatio": 1,
    "cjkPresent": true,
    "cjkCorruptionAbsent": true,
    "qaStatus": "PASS",
    "qaOverall": 92,
    "qaReadability": 96,
    "qaFidelityMode": "measured",
    "qaReferenceFidelity": 88,
    "qaAiLookScore": 4,
    "repairTriggered": false
  },
  "generatedAt": "2026-08-22T11:54:35.842Z"
}