{
  "projectId": "project_9a0d3269-3455-4cc2-a00e-97d8a32bf664",
  "status": "PASS",
  "checks": {
    "chartScoreBefore": 0,
    "chartScoreAfter": 100,
    "failingLabelsBefore": 6,
    "failingLabelsAfter": 0,
    "targetObject": [
      "metric-rate-chart"
    ],
    "targetDimension": "chartLabelCollision",
    "rolledBack": false,
    "dataPreserved": true,
    "geometryPreserved": true,
    "chartTypePreserved": true,
    "labelFontSizeBefore": 48,
    "labelFontSizeAfter": 14,
    "reopenedSlides": 1,
    "nativeChartPresent": true,
    "cjkIntact": true
  },
  "artifacts": {
    "finalPptx": "C:\\Users\\urmylucky\\Documents\\ChatGPT\\PPT\\.worktrees\\chart-label-collision-repair\\generated\\projects\\project_9a0d3269-3455-4cc2-a00e-97d8a32bf664\\output\\final.pptx",
    "beforeContactSheet": "C:\\Users\\urmylucky\\Documents\\ChatGPT\\PPT\\.worktrees\\chart-label-collision-repair\\generated\\projects\\project_9a0d3269-3455-4cc2-a00e-97d8a32bf664\\render\\repair-backup-1\\contact-sheet.webp",
    "afterContactSheet": "C:\\Users\\urmylucky\\Documents\\ChatGPT\\PPT\\.worktrees\\chart-label-collision-repair\\generated\\projects\\project_9a0d3269-3455-4cc2-a00e-97d8a32bf664\\render\\final\\contact-sheet.webp",
    "qaBefore": "C:\\Users\\urmylucky\\Documents\\ChatGPT\\PPT\\.worktrees\\chart-label-collision-repair\\generated\\projects\\project_9a0d3269-3455-4cc2-a00e-97d8a32bf664\\qa\\qa-report-pass-0.json",
    "qaAfter": "C:\\Users\\urmylucky\\Documents\\ChatGPT\\PPT\\.worktrees\\chart-label-collision-repair\\generated\\projects\\project_9a0d3269-3455-4cc2-a00e-97d8a32bf664\\qa\\qa-report-pass-1.json",
    "repairPlan": "C:\\Users\\urmylucky\\Documents\\ChatGPT\\PPT\\.worktrees\\chart-label-collision-repair\\generated\\projects\\project_9a0d3269-3455-4cc2-a00e-97d8a32bf664\\qa\\repair-plan.json",
    "repairEvent": "C:\\Users\\urmylucky\\Documents\\ChatGPT\\PPT\\.worktrees\\chart-label-collision-repair\\generated\\projects\\project_9a0d3269-3455-4cc2-a00e-97d8a32bf664\\qa\\repair-event-1.json",
    "reopenedContactSheet": "C:\\Users\\urmylucky\\Documents\\ChatGPT\\PPT\\.worktrees\\chart-label-collision-repair\\generated\\projects\\project_9a0d3269-3455-4cc2-a00e-97d8a32bf664\\render\\reopened-final\\contact-sheet.webp"
  },
  "generatedAt": "2026-08-22T13:44:59.188Z"
}