{
  "projectId": "project_3f441b66-7129-422b-874d-a564fd8edbf4",
  "status": "PASS",
  "artifacts": {
    "referenceStyleDna": "C:\\Users\\urmylucky\\Documents\\ChatGPT\\PPT\\.worktrees\\image-distortion-local-repair\\generated\\projects\\project_3f441b66-7129-422b-874d-a564fd8edbf4\\style\\style-dna.json",
    "contentAnalysis": "C:\\Users\\urmylucky\\Documents\\ChatGPT\\PPT\\.worktrees\\image-distortion-local-repair\\generated\\projects\\project_3f441b66-7129-422b-874d-a564fd8edbf4\\analysis\\content-analysis.json",
    "storyline": "C:\\Users\\urmylucky\\Documents\\ChatGPT\\PPT\\.worktrees\\image-distortion-local-repair\\generated\\projects\\project_3f441b66-7129-422b-874d-a564fd8edbf4\\storyline\\storyline.json",
    "slidePlan": "C:\\Users\\urmylucky\\Documents\\ChatGPT\\PPT\\.worktrees\\image-distortion-local-repair\\generated\\projects\\project_3f441b66-7129-422b-874d-a564fd8edbf4\\slide-plans\\slide-plans.json",
    "styleMix": "C:\\Users\\urmylucky\\Documents\\ChatGPT\\PPT\\.worktrees\\image-distortion-local-repair\\generated\\projects\\project_3f441b66-7129-422b-874d-a564fd8edbf4\\style\\style-mix.json",
    "qaReport": "C:\\Users\\urmylucky\\Documents\\ChatGPT\\PPT\\.worktrees\\image-distortion-local-repair\\generated\\projects\\project_3f441b66-7129-422b-874d-a564fd8edbf4\\qa\\qa-report.json",
    "repairPlan": "C:\\Users\\urmylucky\\Documents\\ChatGPT\\PPT\\.worktrees\\image-distortion-local-repair\\generated\\projects\\project_3f441b66-7129-422b-874d-a564fd8edbf4\\qa\\repair-plan.json",
    "finalPptx": "C:\\Users\\urmylucky\\Documents\\ChatGPT\\PPT\\.worktrees\\image-distortion-local-repair\\generated\\projects\\project_3f441b66-7129-422b-874d-a564fd8edbf4\\output\\final.pptx",
    "contactSheet": "C:\\Users\\urmylucky\\Documents\\ChatGPT\\PPT\\.worktrees\\image-distortion-local-repair\\generated\\projects\\project_3f441b66-7129-422b-874d-a564fd8edbf4\\render\\final\\contact-sheet.webp",
    "reopenedContactSheet": "C:\\Users\\urmylucky\\Documents\\ChatGPT\\PPT\\.worktrees\\image-distortion-local-repair\\generated\\projects\\project_3f441b66-7129-422b-874d-a564fd8edbf4\\render\\reopened-final\\contact-sheet.webp",
    "strength90": "/api/files?projectId=project_3f441b66-7129-422b-874d-a564fd8edbf4&stage=render&name=previews/strength-90/A/contact-sheet.webp",
    "strength50": "/api/files?projectId=project_3f441b66-7129-422b-874d-a564fd8edbf4&stage=render&name=previews/strength-50/A/contact-sheet.webp"
  },
  "checks": {
    "referenceSlidesRendered": true,
    "strengthDifference": 0.0089,
    "strengthDifferenceVisible": false,
    "distinctDirections": true,
    "selectedDirection": "A",
    "finalPptxOpenable": true,
    "reopenedSlides": 8,
    "typeCounts": {
      "text": 81,
      "shape": 41,
      "chart": 0,
      "table": 0,
      "image": 1
    },
    "nativeObjects": 122,
    "imageObjects": 1,
    "editableRatio": 0.9919,
    "cjkPresent": true,
    "cjkCorruptionAbsent": true,
    "qaStatus": "REVIEW",
    "qaOverall": 91,
    "qaReadability": 90,
    "qaFidelityMode": "measured",
    "qaReferenceFidelity": 91,
    "typographyBefore": 98.3,
    "typographyAfter": 98.3,
    "contrastBefore": 98.7,
    "contrastAfter": 98.7,
    "contrastFailuresBefore": 3,
    "contrastFailuresAfter": 3,
    "imageDistortionBefore": 0,
    "imageDistortionAfter": 100,
    "imageFailuresBefore": 1,
    "imageFailuresAfter": 0,
    "repairRolledBack": false,
    "qaAiLookScore": 4,
    "repairTriggered": true,
    "repairAttempts": 1
  },
  "generatedAt": "2026-08-22T13:49:37.078Z"
}