{
  "projectId": "project_d8fd39d6-604a-4724-8c77-ba1c98cee29e",
  "status": "PASS",
  "artifacts": {
    "referenceStyleDna": "C:\\Users\\urmylucky\\Documents\\ChatGPT\\PPT\\.worktrees\\typography-local-autofix\\generated\\projects\\project_d8fd39d6-604a-4724-8c77-ba1c98cee29e\\style\\style-dna.json",
    "contentAnalysis": "C:\\Users\\urmylucky\\Documents\\ChatGPT\\PPT\\.worktrees\\typography-local-autofix\\generated\\projects\\project_d8fd39d6-604a-4724-8c77-ba1c98cee29e\\analysis\\content-analysis.json",
    "storyline": "C:\\Users\\urmylucky\\Documents\\ChatGPT\\PPT\\.worktrees\\typography-local-autofix\\generated\\projects\\project_d8fd39d6-604a-4724-8c77-ba1c98cee29e\\storyline\\storyline.json",
    "slidePlan": "C:\\Users\\urmylucky\\Documents\\ChatGPT\\PPT\\.worktrees\\typography-local-autofix\\generated\\projects\\project_d8fd39d6-604a-4724-8c77-ba1c98cee29e\\slide-plans\\slide-plans.json",
    "styleMix": "C:\\Users\\urmylucky\\Documents\\ChatGPT\\PPT\\.worktrees\\typography-local-autofix\\generated\\projects\\project_d8fd39d6-604a-4724-8c77-ba1c98cee29e\\style\\style-mix.json",
    "qaReport": "C:\\Users\\urmylucky\\Documents\\ChatGPT\\PPT\\.worktrees\\typography-local-autofix\\generated\\projects\\project_d8fd39d6-604a-4724-8c77-ba1c98cee29e\\qa\\qa-report.json",
    "repairPlan": null,
    "finalPptx": "C:\\Users\\urmylucky\\Documents\\ChatGPT\\PPT\\.worktrees\\typography-local-autofix\\generated\\projects\\project_d8fd39d6-604a-4724-8c77-ba1c98cee29e\\output\\final.pptx",
    "contactSheet": "C:\\Users\\urmylucky\\Documents\\ChatGPT\\PPT\\.worktrees\\typography-local-autofix\\generated\\projects\\project_d8fd39d6-604a-4724-8c77-ba1c98cee29e\\render\\final\\contact-sheet.webp",
    "reopenedContactSheet": "C:\\Users\\urmylucky\\Documents\\ChatGPT\\PPT\\.worktrees\\typography-local-autofix\\generated\\projects\\project_d8fd39d6-604a-4724-8c77-ba1c98cee29e\\render\\reopened-final\\contact-sheet.webp",
    "strength90": "/api/files?projectId=project_d8fd39d6-604a-4724-8c77-ba1c98cee29e&stage=render&name=previews/strength-90/A/contact-sheet.webp",
    "strength50": "/api/files?projectId=project_d8fd39d6-604a-4724-8c77-ba1c98cee29e&stage=render&name=previews/strength-50/A/contact-sheet.webp"
  },
  "checks": {
    "referenceSlidesRendered": true,
    "strengthDifference": 0.0103,
    "strengthDifferenceVisible": true,
    "distinctDirections": true,
    "selectedDirection": "B",
    "finalPptxOpenable": true,
    "reopenedSlides": 8,
    "typeCounts": {
      "text": 72,
      "shape": 35,
      "chart": 1,
      "table": 0,
      "image": 0
    },
    "nativeObjects": 108,
    "imageObjects": 0,
    "editableRatio": 1,
    "cjkPresent": true,
    "cjkCorruptionAbsent": true,
    "qaStatus": "PASS",
    "qaOverall": 93,
    "qaReadability": 96,
    "qaFidelityMode": "measured",
    "qaReferenceFidelity": 96,
    "typographyBefore": 96.1,
    "typographyAfter": 96.1,
    "repairRolledBack": false,
    "qaAiLookScore": 4,
    "repairTriggered": false
  },
  "generatedAt": "2026-08-22T12:36:10.485Z"
}