{
  "projectId": "project_e7762e9b-ec71-4b7b-8d32-5901098e278f",
  "status": "PASS",
  "artifacts": {
    "referenceStyleDna": "C:\\Users\\urmylucky\\Documents\\ChatGPT\\PPT\\.worktrees\\font-fallback-local-repair\\generated\\projects\\project_e7762e9b-ec71-4b7b-8d32-5901098e278f\\style\\style-dna.json",
    "contentAnalysis": "C:\\Users\\urmylucky\\Documents\\ChatGPT\\PPT\\.worktrees\\font-fallback-local-repair\\generated\\projects\\project_e7762e9b-ec71-4b7b-8d32-5901098e278f\\analysis\\content-analysis.json",
    "storyline": "C:\\Users\\urmylucky\\Documents\\ChatGPT\\PPT\\.worktrees\\font-fallback-local-repair\\generated\\projects\\project_e7762e9b-ec71-4b7b-8d32-5901098e278f\\storyline\\storyline.json",
    "slidePlan": "C:\\Users\\urmylucky\\Documents\\ChatGPT\\PPT\\.worktrees\\font-fallback-local-repair\\generated\\projects\\project_e7762e9b-ec71-4b7b-8d32-5901098e278f\\slide-plans\\slide-plans.json",
    "styleMix": "C:\\Users\\urmylucky\\Documents\\ChatGPT\\PPT\\.worktrees\\font-fallback-local-repair\\generated\\projects\\project_e7762e9b-ec71-4b7b-8d32-5901098e278f\\style\\style-mix.json",
    "qaReport": "C:\\Users\\urmylucky\\Documents\\ChatGPT\\PPT\\.worktrees\\font-fallback-local-repair\\generated\\projects\\project_e7762e9b-ec71-4b7b-8d32-5901098e278f\\qa\\qa-report.json",
    "repairPlan": "C:\\Users\\urmylucky\\Documents\\ChatGPT\\PPT\\.worktrees\\font-fallback-local-repair\\generated\\projects\\project_e7762e9b-ec71-4b7b-8d32-5901098e278f\\qa\\repair-plan.json",
    "finalPptx": "C:\\Users\\urmylucky\\Documents\\ChatGPT\\PPT\\.worktrees\\font-fallback-local-repair\\generated\\projects\\project_e7762e9b-ec71-4b7b-8d32-5901098e278f\\output\\final.pptx",
    "contactSheet": "C:\\Users\\urmylucky\\Documents\\ChatGPT\\PPT\\.worktrees\\font-fallback-local-repair\\generated\\projects\\project_e7762e9b-ec71-4b7b-8d32-5901098e278f\\render\\final\\contact-sheet.webp",
    "reopenedContactSheet": "C:\\Users\\urmylucky\\Documents\\ChatGPT\\PPT\\.worktrees\\font-fallback-local-repair\\generated\\projects\\project_e7762e9b-ec71-4b7b-8d32-5901098e278f\\render\\reopened-final\\contact-sheet.webp",
    "strength90": "/api/files?projectId=project_e7762e9b-ec71-4b7b-8d32-5901098e278f&stage=render&name=previews/strength-90/A/contact-sheet.webp",
    "strength50": "/api/files?projectId=project_e7762e9b-ec71-4b7b-8d32-5901098e278f&stage=render&name=previews/strength-50/A/contact-sheet.webp"
  },
  "checks": {
    "referenceSlidesRendered": true,
    "strengthDifference": 0.0103,
    "strengthDifferenceVisible": true,
    "distinctDirections": true,
    "selectedDirection": "B",
    "finalPptxOpenable": true,
    "reopenedSlides": 8,
    "typeCounts": {
      "text": 72,
      "shape": 35,
      "chart": 1,
      "table": 0,
      "image": 0
    },
    "nativeObjects": 108,
    "imageObjects": 0,
    "editableRatio": 1,
    "cjkPresent": true,
    "cjkCorruptionAbsent": true,
    "qaStatus": "PASS",
    "qaOverall": 93,
    "qaReadability": 96,
    "qaFidelityMode": "measured",
    "qaReferenceFidelity": 96,
    "typographyBefore": 96.1,
    "typographyAfter": 96.1,
    "contrastBefore": 95.5,
    "contrastAfter": 100,
    "contrastFailuresBefore": 29,
    "contrastFailuresAfter": 0,
    "fontFallbackBefore": 0,
    "fontFallbackAfter": 100,
    "fontFallbackFailuresBefore": 44,
    "fontFallbackFailuresAfter": 0,
    "repairRolledBack": false,
    "qaAiLookScore": 4,
    "repairTriggered": true,
    "repairAttempts": 2
  },
  "generatedAt": "2026-08-22T13:39:44.328Z"
}